project_id,project_name,project_summary,admin_profile_id,date_created,date_updated
16,"Bird Box","When a mysterious force decimates the population, only one thing is certain -- if you see it, you die. The survivors must now avoid coming face to face with an entity that takes the form of their worst fears.",NULL,"2021-12-19 17:08:23","2021-12-19 17:08:23"
17,Vivo,"Explore high-tech and powerful vivo smartphone and accessories",NULL,"2021-12-19 17:33:30","2021-12-19 17:33:30"
18,Gundam,"Gundam is a Japanese military fiction media franchise/media mix.",NULL,"2021-12-19 17:34:17","2021-12-19 17:34:17"
19,Tiktok,"TikTok, known in China as Douyin, is a video-focused social networking service owned by Chinese company ByteDance. ",NULL,"2021-12-19 17:37:09","2021-12-19 17:37:09"
20,Instagram,"Instagram is an American photo and video sharing social networking service founded by Kevin Systrom and Mike Krieger.",NULL,"2021-12-19 17:38:12","2021-12-19 17:38:12"
